{
  "errcode": 0,
  "errmsg": "ok",
  "userid": "{{userid}}",
  "name": "{{name}}",
  "department": [
    3
  ],
  "position": "",
  "mobile": "{{mobile}}",
  "gender": "0",
  "email": "",
  "avatar": "",
  "status": 4,
  "isleader": 0,
  "extattr": {
    "attrs": [

    ]
  },
  "telephone": "",
  "enable": 1,
  "hide_mobile": 0,
  "order": [
    0
  ],
  "qr_code": "https://open.work.weixin.qq.com/wwopen/userQRCode?vcode=vcf5913654e4b1be65",
  "alias": "",
  "is_leader_in_dept": [
    0
  ],
  "address": "杭州",
  "thumb_avatar": ""
}